{
  "$schema": "https://json-schema.org/draft/2020-12/schema",
  "$id": "https://github.com/Gioixxx/claude-libs/ralph/prd.schema.json",
  "title": "Ralph PRD",
  "description": "Contratto per prd.json usato da Ralph (sviluppo autonomo iterativo).",
  "type": "object",
  "additionalProperties": false,
  "properties": {
    "_comment": {
      "type": "string",
      "description": "Note opzionali non lette dagli script Ralph."
    },
    "project": {
      "type": "string",
      "minLength": 1
    },
    "branchName": {
      "type": "string",
      "minLength": 1
    },
    "description": {
      "type": "string",
      "minLength": 1
    },
    "stack": {
      "type": "string",
      "enum": [
        "dotnet",
        "spring",
        "angular",
        "electron",
        "nextjs",
        "fastapi",
        "react-native",
        "nestjs",
        "wpf",
        "go"
      ],
      "description": "Stack tecnico di riferimento (allineato a stacks/ in claude-libs)."
    },
    "libs": {
      "type": "array",
      "minItems": 1,
      "items": {
        "type": "string",
        "pattern": "^(arch|stacks|workflows|snippets)/[a-z0-9_-]+\\.md$"
      },
      "description": "Percorsi relativi a .claude/libs senza prefisso (es. stacks/dotnet.md)."
    },
    "buildCommand": {
      "type": "string",
      "minLength": 1
    },
    "testCommand": {
      "type": "string",
      "minLength": 1
    },
    "contextSync": {
      "type": "boolean",
      "default": true,
      "description": "Se true, esegue story-context-sync dopo ogni storia completata: aggiorna memoria, CLAUDE.md, docs/ e catalog.json via Ollama (best-effort)."
    },
    "iterationCommands": {
      "type": "array",
      "items": { "type": "string" },
      "default": ["review", "style-check", "security-check", "test", "changelog", "remember"],
      "description": "Fasi eseguite ad ogni iterazione. Ogni nome risolve PRIMA al custom file .claude/commands/<nome>.md (override per-progetto), altrimenti alla skill first-party di Claude Code equivalente: review→/code-review, security-check→/security-review, test→/verify. I nomi senza custom file né mapping built-in vengono saltati con un avviso. Se assente vale il default."
    },
    "reviewGate": {
      "type": "boolean",
      "default": false,
      "description": "Se true, ogni storia è marcata passes=true solo dopo che /code-review (+ /security-review) non riportano rilievi bloccanti: i rilievi vanno corretti nella stessa iterazione prima di proseguire. Vedi ralph/skills/review-gate.md."
    },
    "pullRequest": {
      "type": "boolean",
      "default": false,
      "description": "Se true, dopo il commit di ogni storia Ralph pusha il branch e apre/mantiene una PR draft (gh, best-effort). Vedi ralph/skills/pull-request.md."
    },
    "agentTeam": {
      "type": "boolean",
      "default": false,
      "description": "Default a livello PRD: se true, ogni storia è lavorata da un team di subagent con ruoli (planner → implementer → tester → reviewer) via Task tool, anziché da un singolo agente. Sovrascrivibile per-storia. Il reviewer assorbe reviewGate. Vedi ralph/skills/agent-team.md."
    },
    "teamRoles": {
      "$ref": "#/$defs/teamRoles",
      "description": "Default a livello PRD dei ruoli della pipeline quando agentTeam è attivo. Se assente: planner, implementer, tester, reviewer."
    },
    "userStories": {
      "type": "array",
      "minItems": 1,
      "items": { "$ref": "#/$defs/userStory" }
    }
  },
  "required": [
    "project",
    "branchName",
    "description",
    "stack",
    "libs",
    "buildCommand",
    "testCommand",
    "userStories"
  ],
  "$defs": {
    "userStory": {
      "type": "object",
      "additionalProperties": false,
      "properties": {
        "id": {
          "type": "string",
          "pattern": "^US-[0-9]+$",
          "description": "Identificativo storia (es. US-001)."
        },
        "title": { "type": "string", "minLength": 1 },
        "description": { "type": "string", "minLength": 1 },
        "acceptanceCriteria": {
          "type": "array",
          "minItems": 1,
          "items": { "type": "string", "minLength": 1 }
        },
        "priority": { "type": "integer", "minimum": 1 },
        "passes": { "type": "boolean" },
        "notes": { "type": "string" },
        "dependsOn": {
          "type": "array",
          "items": {
            "type": "string",
            "pattern": "^US-[0-9]+$"
          },
          "description": "ID di storie che devono avere passes=true prima che questa possa iniziare.",
          "default": []
        },
        "agentTeam": {
          "type": "boolean",
          "description": "Override per-storia del flag PRD agentTeam: forza on/off il team di ruoli solo per questa storia."
        },
        "teamRoles": {
          "$ref": "#/$defs/teamRoles",
          "description": "Override per-storia dei ruoli della pipeline (sottoinsieme ordinato) quando agentTeam è attivo per questa storia."
        }
      },
      "required": [
        "id",
        "title",
        "description",
        "acceptanceCriteria",
        "priority",
        "passes",
        "notes"
      ]
    },
    "teamRoles": {
      "type": "array",
      "minItems": 1,
      "uniqueItems": true,
      "items": {
        "type": "string",
        "enum": ["planner", "implementer", "tester", "reviewer"]
      },
      "description": "Ruoli della pipeline agentTeam, nell'ordine di esecuzione. Consente team 'lite' (es. ['implementer','reviewer'])."
    }
  }
}
